{
  "schema_version": "1.0",
  "view_id": "graph-p1-fixed-100",
  "formal": false,
  "scan_ref": {
    "scan_id": "scn-p1-fixed-target-completed",
    "revision": "e2d8c016ef5f4cfcddd23abb0205ec41c7cf3db1",
    "facts_hash": "aa47db4015c1dade1138819a21f41aaa7bf8e406bf68f1b55c58096535449cc5",
    "input_hash": "e8e1fabd6f93a3d5ada1609cf57044f0e6245704515456916a5b2e886c5794ad",
    "inventory_hash": "8d70aa1a3bf6f02b7366d1b2f30ba6f927e2880c83ed77e17fce15a10757f6a2",
    "status": "completed",
    "registry_revision": 2
  },
  "filter": {
    "resource_ids": [],
    "resource_kinds": []
  },
  "nodes": [
    {
      "id": "node-project",
      "kind": "project",
      "source_id": "openguard",
      "label": "OpenGuard"
    },
    {
      "id": "node-root-license",
      "kind": "license_observation",
      "source_id": "fact.root.openguard",
      "label": "根 LICENSE 标题观察"
    },
    {
      "id": "node-root-evidence",
      "kind": "evidence",
      "source_id": "ev.root.license",
      "label": "LICENSE 字节证据"
    },
    {
      "id": "node-root-finding",
      "kind": "finding",
      "source_id": "finding.root.notice-missing",
      "label": "根 NOTICE 缺口"
    },
    {
      "id": "node-obligation",
      "kind": "obligation",
      "source_id": "obl-p1-apache-notice-review",
      "label": "Apache NOTICE 待复核义务"
    },
    {
      "id": "node-jackson",
      "kind": "component",
      "source_id": "cmp-jackson-databind",
      "label": "Jackson Databind 2.21.5"
    },
    {
      "id": "node-jackson-license",
      "kind": "license_observation",
      "source_id": "fact.dep.jackson-databind",
      "label": "Jackson LICENSE 观察"
    },
    {
      "id": "node-jackson-notice",
      "kind": "evidence",
      "source_id": "ev.jackson.notice",
      "label": "Jackson NOTICE 证据"
    },
    {
      "id": "node-bert",
      "kind": "ai_asset",
      "source_id": "huggingface:model:google-bert/bert-base-uncased",
      "label": "BERT 固定快照"
    },
    {
      "id": "node-bert-license",
      "kind": "license_observation",
      "source_id": "fact.ai.bert",
      "label": "BERT provider 声明"
    },
    {
      "id": "node-bert-evidence",
      "kind": "evidence",
      "source_id": "ev.hf.bert.license",
      "label": "BERT provider snapshot"
    },
    {
      "id": "node-component-0000",
      "kind": "component",
      "source_id": "cmp-fixed-0000",
      "label": "固定组件 0000"
    },
    {
      "id": "node-component-0001",
      "kind": "component",
      "source_id": "cmp-fixed-0001",
      "label": "固定组件 0001"
    },
    {
      "id": "node-component-0002",
      "kind": "component",
      "source_id": "cmp-fixed-0002",
      "label": "固定组件 0002"
    },
    {
      "id": "node-component-0003",
      "kind": "component",
      "source_id": "cmp-fixed-0003",
      "label": "固定组件 0003"
    },
    {
      "id": "node-component-0004",
      "kind": "component",
      "source_id": "cmp-fixed-0004",
      "label": "固定组件 0004"
    },
    {
      "id": "node-component-0005",
      "kind": "component",
      "source_id": "cmp-fixed-0005",
      "label": "固定组件 0005"
    },
    {
      "id": "node-component-0006",
      "kind": "component",
      "source_id": "cmp-fixed-0006",
      "label": "固定组件 0006"
    },
    {
      "id": "node-component-0007",
      "kind": "component",
      "source_id": "cmp-fixed-0007",
      "label": "固定组件 0007"
    },
    {
      "id": "node-component-0008",
      "kind": "component",
      "source_id": "cmp-fixed-0008",
      "label": "固定组件 0008"
    },
    {
      "id": "node-component-0009",
      "kind": "component",
      "source_id": "cmp-fixed-0009",
      "label": "固定组件 0009"
    },
    {
      "id": "node-component-0010",
      "kind": "component",
      "source_id": "cmp-fixed-0010",
      "label": "固定组件 0010"
    },
    {
      "id": "node-component-0011",
      "kind": "component",
      "source_id": "cmp-fixed-0011",
      "label": "固定组件 0011"
    },
    {
      "id": "node-component-0012",
      "kind": "component",
      "source_id": "cmp-fixed-0012",
      "label": "固定组件 0012"
    },
    {
      "id": "node-component-0013",
      "kind": "component",
      "source_id": "cmp-fixed-0013",
      "label": "固定组件 0013"
    },
    {
      "id": "node-component-0014",
      "kind": "component",
      "source_id": "cmp-fixed-0014",
      "label": "固定组件 0014"
    },
    {
      "id": "node-component-0015",
      "kind": "component",
      "source_id": "cmp-fixed-0015",
      "label": "固定组件 0015"
    },
    {
      "id": "node-component-0016",
      "kind": "component",
      "source_id": "cmp-fixed-0016",
      "label": "固定组件 0016"
    },
    {
      "id": "node-component-0017",
      "kind": "component",
      "source_id": "cmp-fixed-0017",
      "label": "固定组件 0017"
    },
    {
      "id": "node-component-0018",
      "kind": "component",
      "source_id": "cmp-fixed-0018",
      "label": "固定组件 0018"
    },
    {
      "id": "node-component-0019",
      "kind": "component",
      "source_id": "cmp-fixed-0019",
      "label": "固定组件 0019"
    },
    {
      "id": "node-component-0020",
      "kind": "component",
      "source_id": "cmp-fixed-0020",
      "label": "固定组件 0020"
    },
    {
      "id": "node-component-0021",
      "kind": "component",
      "source_id": "cmp-fixed-0021",
      "label": "固定组件 0021"
    },
    {
      "id": "node-component-0022",
      "kind": "component",
      "source_id": "cmp-fixed-0022",
      "label": "固定组件 0022"
    },
    {
      "id": "node-component-0023",
      "kind": "component",
      "source_id": "cmp-fixed-0023",
      "label": "固定组件 0023"
    },
    {
      "id": "node-component-0024",
      "kind": "component",
      "source_id": "cmp-fixed-0024",
      "label": "固定组件 0024"
    },
    {
      "id": "node-component-0025",
      "kind": "component",
      "source_id": "cmp-fixed-0025",
      "label": "固定组件 0025"
    },
    {
      "id": "node-component-0026",
      "kind": "component",
      "source_id": "cmp-fixed-0026",
      "label": "固定组件 0026"
    },
    {
      "id": "node-component-0027",
      "kind": "component",
      "source_id": "cmp-fixed-0027",
      "label": "固定组件 0027"
    },
    {
      "id": "node-component-0028",
      "kind": "component",
      "source_id": "cmp-fixed-0028",
      "label": "固定组件 0028"
    },
    {
      "id": "node-component-0029",
      "kind": "component",
      "source_id": "cmp-fixed-0029",
      "label": "固定组件 0029"
    },
    {
      "id": "node-component-0030",
      "kind": "component",
      "source_id": "cmp-fixed-0030",
      "label": "固定组件 0030"
    },
    {
      "id": "node-component-0031",
      "kind": "component",
      "source_id": "cmp-fixed-0031",
      "label": "固定组件 0031"
    },
    {
      "id": "node-component-0032",
      "kind": "component",
      "source_id": "cmp-fixed-0032",
      "label": "固定组件 0032"
    },
    {
      "id": "node-component-0033",
      "kind": "component",
      "source_id": "cmp-fixed-0033",
      "label": "固定组件 0033"
    },
    {
      "id": "node-component-0034",
      "kind": "component",
      "source_id": "cmp-fixed-0034",
      "label": "固定组件 0034"
    },
    {
      "id": "node-component-0035",
      "kind": "component",
      "source_id": "cmp-fixed-0035",
      "label": "固定组件 0035"
    },
    {
      "id": "node-component-0036",
      "kind": "component",
      "source_id": "cmp-fixed-0036",
      "label": "固定组件 0036"
    },
    {
      "id": "node-component-0037",
      "kind": "component",
      "source_id": "cmp-fixed-0037",
      "label": "固定组件 0037"
    },
    {
      "id": "node-component-0038",
      "kind": "component",
      "source_id": "cmp-fixed-0038",
      "label": "固定组件 0038"
    },
    {
      "id": "node-component-0039",
      "kind": "component",
      "source_id": "cmp-fixed-0039",
      "label": "固定组件 0039"
    },
    {
      "id": "node-component-0040",
      "kind": "component",
      "source_id": "cmp-fixed-0040",
      "label": "固定组件 0040"
    },
    {
      "id": "node-component-0041",
      "kind": "component",
      "source_id": "cmp-fixed-0041",
      "label": "固定组件 0041"
    },
    {
      "id": "node-component-0042",
      "kind": "component",
      "source_id": "cmp-fixed-0042",
      "label": "固定组件 0042"
    },
    {
      "id": "node-component-0043",
      "kind": "component",
      "source_id": "cmp-fixed-0043",
      "label": "固定组件 0043"
    },
    {
      "id": "node-component-0044",
      "kind": "component",
      "source_id": "cmp-fixed-0044",
      "label": "固定组件 0044"
    },
    {
      "id": "node-component-0045",
      "kind": "component",
      "source_id": "cmp-fixed-0045",
      "label": "固定组件 0045"
    },
    {
      "id": "node-component-0046",
      "kind": "component",
      "source_id": "cmp-fixed-0046",
      "label": "固定组件 0046"
    },
    {
      "id": "node-component-0047",
      "kind": "component",
      "source_id": "cmp-fixed-0047",
      "label": "固定组件 0047"
    },
    {
      "id": "node-component-0048",
      "kind": "component",
      "source_id": "cmp-fixed-0048",
      "label": "固定组件 0048"
    },
    {
      "id": "node-component-0049",
      "kind": "component",
      "source_id": "cmp-fixed-0049",
      "label": "固定组件 0049"
    },
    {
      "id": "node-component-0050",
      "kind": "component",
      "source_id": "cmp-fixed-0050",
      "label": "固定组件 0050"
    },
    {
      "id": "node-component-0051",
      "kind": "component",
      "source_id": "cmp-fixed-0051",
      "label": "固定组件 0051"
    },
    {
      "id": "node-component-0052",
      "kind": "component",
      "source_id": "cmp-fixed-0052",
      "label": "固定组件 0052"
    },
    {
      "id": "node-component-0053",
      "kind": "component",
      "source_id": "cmp-fixed-0053",
      "label": "固定组件 0053"
    },
    {
      "id": "node-component-0054",
      "kind": "component",
      "source_id": "cmp-fixed-0054",
      "label": "固定组件 0054"
    },
    {
      "id": "node-component-0055",
      "kind": "component",